{
  "schemaVersion": "1.0",
  "corpusId": "scce-rehearsal-20260816",
  "description": "Development rehearsal manifest: 4 documents byte-exact-dumped from the live scce3_runtime blobs table (sha256 verified against stored content_hash). Single-operator rehearsal, not an independent sealed evaluation.",
  "documents": [
    {
      "documentId": "doc-star-trek",
      "path": "corpus/star-trek.txt",
      "sha256": "a73652b33c5d26cbca8fc4a2525af95dff0f057517fdd896e825363b8ffb808b",
      "sizeBytes": 46251,
      "mediaType": "text/plain",
      "normalization": "none"
    },
    {
      "documentId": "doc-star-trek-tos",
      "path": "corpus/star-trek-tos.txt",
      "sha256": "f0d1cbff876e35a42d0b3df84489f82f740528abc085abba5c28399eda9c1773",
      "sizeBytes": 76489,
      "mediaType": "text/plain",
      "normalization": "none"
    },
    {
      "documentId": "doc-star-trek-ds9",
      "path": "corpus/star-trek-ds9.txt",
      "sha256": "12aeb98a1d72efafa039b7776e6d29a11b55eda6b03d940e79cd42e5e3976e83",
      "sizeBytes": 57539,
      "mediaType": "text/plain",
      "normalization": "none"
    },
    {
      "documentId": "doc-ada-lovelace",
      "path": "corpus/ada-lovelace.txt",
      "sha256": "5aeef93e53f63d21e9477eca686be2f43d3d94dee7e7d49f391db657ac47dd70",
      "sizeBytes": 38210,
      "mediaType": "text/plain",
      "normalization": "none"
    }
  ]
}
